{
  "schema_version": 1,
  "id": "XT-103",
  "title": "Certify transient Harness branch reclamation",
  "plan": "DP-HARNESS-BRANCH-RECLAMATION",
  "criteria": [
    "CRIT-HV2-WORK-BRANCH-RECLAMATION",
    "CRIT-HV2-QUEUE-BRANCH-RECLAMATION",
    "CRIT-HV2-BRANCH-GC-RECOVERY"
  ],
  "depends_on": [
    "XT-098",
    "XT-101"
  ],
  "owned_paths": [
    "docs/adr/0019-harness-transient-branch-retention.md",
    "docs/harness-v2/acceptance-checklist.md",
    "docs/harness-v2/architecture.md",
    "docs/harness-v2/delivery-flow.md",
    "docs/harness-v2/pilot-operations.md",
    "docs/harness-v2/worklog.md"
  ],
  "type": "documentation",
  "workstream": "harness_operations",
  "risk": {
    "functionality": "low",
    "security": "none",
    "performance": "low",
    "compatibility": "none",
    "concurrency": "none",
    "platform": "none",
    "persistence": "none"
  },
  "tdd": {
    "mode": "not_required",
    "gate": null,
    "proof_paths": [],
    "oracle_paths": [],
    "failure_fingerprints": []
  },
  "delivery": {
    "commit_type": "docs",
    "scope": "harness",
    "summary": "document branch reclamation operations",
    "architecture_change": {
      "mode": "none",
      "modules": [],
      "supersedes": {
        "paths": [],
        "symbols": [],
        "targets": []
      },
      "temporary_leases": [],
      "retires_leases": []
    }
  }
}
